nom,type,ville,telephone,description
Répit Solidaire,répit,Montréal,514-000-1000,Service fictif de répit à domicile pour proches aidants.
Ligne Aidants Écoute,écoute,Québec,418-000-2000,Écoute confidentielle et orientation psychosociale.
Atelier Mémoire et Soins,formation,Laval,450-000-3000,Ateliers fictifs sur l'organisation des soins et la prévention de l'épuisement.
Transport Santé Communautaire,transport,Longueuil,450-000-4000,Transport fictif pour rendez-vous médicaux.
Clinique Information Droits,juridique,Montréal,514-000-5000,"Information générale sur procuration, congés et droits des aidants."
